{
  "schemaVersion": "1.0.0",
  "manifestId": "T18-CALF-ORIGIN-INSERTION-2026-09-27",
  "fixtureOnly": false,
  "subjects": [
    {
      "id": "HA-M-000001",
      "kind": "individual_muscle",
      "recordType": "canonical",
      "fields": [
        "origin",
        "insertion"
      ]
    },
    {
      "id": "HA-M-000002",
      "kind": "individual_muscle",
      "recordType": "canonical",
      "fields": [
        "origin",
        "insertion"
      ]
    },
    {
      "id": "HA-M-000003",
      "kind": "individual_muscle",
      "recordType": "canonical",
      "fields": [
        "origin",
        "insertion"
      ]
    },
    {
      "id": "HA-M-000004",
      "kind": "individual_muscle",
      "recordType": "canonical",
      "fields": [
        "origin",
        "insertion"
      ]
    },
    {
      "id": "HA-M-000005",
      "kind": "individual_muscle",
      "recordType": "canonical",
      "fields": [
        "origin",
        "insertion"
      ]
    },
    {
      "id": "HA-M-000006",
      "kind": "individual_muscle",
      "recordType": "canonical",
      "fields": [
        "origin",
        "insertion"
      ]
    }
  ],
  "sources": [
    {
      "id": "T18-HANDS-ON-ANATOMY-2024",
      "underlyingWorkId": "WORK-HANDS-ON-ANATOMY-2024",
      "workIdentityBasis": "A separate 2024 textbook publication by Jacqueline Phillips and Michael O'Hara; its title/copyright page and Chapter 7 were opened. This is not the StatPearls table rehosted under another URL. Publication-level distinction is established; shared textbook lineage was not exhaustively traced.",
      "title": "7. The Knee and Lower Leg | Hands-on Anatomy",
      "url": "https://temple.manifoldapp.org/read/a852952e-bd23-4a54-be97-be3a7ef5039f/section/fbaf4654-749e-4c63-baed-5d17cf03aafe",
      "editionStatus": "verified",
      "edition": "Hands-on Anatomy, 2024 publication (no numbered edition stated), Chapter 7: The Knee and Lower Leg; title/copyright page states ©2024."
    },
    {
      "id": "T18-STATPEARLS-FOOT-MUSCLES-2025",
      "underlyingWorkId": "WORK-STATPEARLS-CARD-BORDONI-2025",
      "workIdentityBasis": "A separately titled and authored StatPearls review/table cited to RK Card and B Bordoni, updated 2025-12-09; the exact article citation is printed below Table 1. It is not a rehost of Hands-on Anatomy. Bibliographic separation is established; upstream source lineage was not exhaustively traced.",
      "title": "Table 1. Overview of the Extrinsic Foot Muscles | StatPearls",
      "url": "https://www.ncbi.nlm.nih.gov/books/NBK539705/table/article-32230.table0/",
      "editionStatus": "verified",
      "edition": "Card RK, Bordoni B. Anatomy, Bony Pelvis and Lower Limb, Foot Muscles. Updated 2025-12-09. In: StatPearls [Internet], 2026 Jan-. Table 1."
    }
  ],
  "accesses": [
    {
      "id": "A-HOA-HA-M-000001-origin",
      "sourceId": "T18-HANDS-ON-ANATOMY-2024",
      "subjectId": "HA-M-000001",
      "field": "origin",
      "locator": "Chapter 7 > Musculature with Palpation Instructions > Gastrocnemius > Origin(s)",
      "accessedOn": "2026-09-27",
      "accessMethod": "publisher_full_text",
      "textAccess": "full_text_opened",
      "accessOutcome": "opened",
      "note": "Opened the named source page and inspected the field for 비복근."
    },
    {
      "id": "A-SP-HA-M-000001-origin",
      "sourceId": "T18-STATPEARLS-FOOT-MUSCLES-2025",
      "subjectId": "HA-M-000001",
      "field": "origin",
      "locator": "Table 1, Gastrocnemius row, Origin column",
      "accessedOn": "2026-09-27",
      "accessMethod": "repository_full_text",
      "textAccess": "full_text_opened",
      "accessOutcome": "opened",
      "note": "Opened the named source page and inspected the field for 비복근."
    },
    {
      "id": "A-HOA-HA-M-000001-insertion",
      "sourceId": "T18-HANDS-ON-ANATOMY-2024",
      "subjectId": "HA-M-000001",
      "field": "insertion",
      "locator": "Chapter 7 > Gastrocnemius > Insertion(s)",
      "accessedOn": "2026-09-27",
      "accessMethod": "publisher_full_text",
      "textAccess": "full_text_opened",
      "accessOutcome": "opened",
      "note": "Opened the named source page and inspected the field for 비복근."
    },
    {
      "id": "A-SP-HA-M-000001-insertion",
      "sourceId": "T18-STATPEARLS-FOOT-MUSCLES-2025",
      "subjectId": "HA-M-000001",
      "field": "insertion",
      "locator": "Table 1, Gastrocnemius row, Insertion column",
      "accessedOn": "2026-09-27",
      "accessMethod": "repository_full_text",
      "textAccess": "full_text_opened",
      "accessOutcome": "opened",
      "note": "Opened the named source page and inspected the field for 비복근."
    },
    {
      "id": "A-HOA-HA-M-000002-origin",
      "sourceId": "T18-HANDS-ON-ANATOMY-2024",
      "subjectId": "HA-M-000002",
      "field": "origin",
      "locator": "Chapter 7 > Soleus > Origin(s)",
      "accessedOn": "2026-09-27",
      "accessMethod": "publisher_full_text",
      "textAccess": "full_text_opened",
      "accessOutcome": "opened",
      "note": "Opened the named source page and inspected the field for 가자미근."
    },
    {
      "id": "A-SP-HA-M-000002-origin",
      "sourceId": "T18-STATPEARLS-FOOT-MUSCLES-2025",
      "subjectId": "HA-M-000002",
      "field": "origin",
      "locator": "Table 1, Soleus row, Origin column",
      "accessedOn": "2026-09-27",
      "accessMethod": "repository_full_text",
      "textAccess": "full_text_opened",
      "accessOutcome": "opened",
      "note": "Opened the named source page and inspected the field for 가자미근."
    },
    {
      "id": "A-HOA-HA-M-000002-insertion",
      "sourceId": "T18-HANDS-ON-ANATOMY-2024",
      "subjectId": "HA-M-000002",
      "field": "insertion",
      "locator": "Chapter 7 > Soleus > Insertion(s)",
      "accessedOn": "2026-09-27",
      "accessMethod": "publisher_full_text",
      "textAccess": "full_text_opened",
      "accessOutcome": "opened",
      "note": "Opened the named source page and inspected the field for 가자미근."
    },
    {
      "id": "A-SP-HA-M-000002-insertion",
      "sourceId": "T18-STATPEARLS-FOOT-MUSCLES-2025",
      "subjectId": "HA-M-000002",
      "field": "insertion",
      "locator": "Table 1, Soleus row, Insertion column",
      "accessedOn": "2026-09-27",
      "accessMethod": "repository_full_text",
      "textAccess": "full_text_opened",
      "accessOutcome": "opened",
      "note": "Opened the named source page and inspected the field for 가자미근."
    },
    {
      "id": "A-HOA-HA-M-000003-origin",
      "sourceId": "T18-HANDS-ON-ANATOMY-2024",
      "subjectId": "HA-M-000003",
      "field": "origin",
      "locator": "Chapter 7 > Tibialis Anterior > Origin(s)",
      "accessedOn": "2026-09-27",
      "accessMethod": "publisher_full_text",
      "textAccess": "full_text_opened",
      "accessOutcome": "opened",
      "note": "Opened the named source page and inspected the field for 전경골근."
    },
    {
      "id": "A-SP-HA-M-000003-origin",
      "sourceId": "T18-STATPEARLS-FOOT-MUSCLES-2025",
      "subjectId": "HA-M-000003",
      "field": "origin",
      "locator": "Table 1, Tibialis anterior row, Origin column",
      "accessedOn": "2026-09-27",
      "accessMethod": "repository_full_text",
      "textAccess": "full_text_opened",
      "accessOutcome": "opened",
      "note": "Opened the named source page and inspected the field for 전경골근."
    },
    {
      "id": "A-HOA-HA-M-000003-insertion",
      "sourceId": "T18-HANDS-ON-ANATOMY-2024",
      "subjectId": "HA-M-000003",
      "field": "insertion",
      "locator": "Chapter 7 > Tibialis Anterior > Insertion(s)",
      "accessedOn": "2026-09-27",
      "accessMethod": "publisher_full_text",
      "textAccess": "full_text_opened",
      "accessOutcome": "opened",
      "note": "Opened the named source page and inspected the field for 전경골근."
    },
    {
      "id": "A-SP-HA-M-000003-insertion",
      "sourceId": "T18-STATPEARLS-FOOT-MUSCLES-2025",
      "subjectId": "HA-M-000003",
      "field": "insertion",
      "locator": "Table 1, Tibialis anterior row, Insertion column",
      "accessedOn": "2026-09-27",
      "accessMethod": "repository_full_text",
      "textAccess": "full_text_opened",
      "accessOutcome": "opened",
      "note": "Opened the named source page and inspected the field for 전경골근."
    },
    {
      "id": "A-HOA-HA-M-000004-origin",
      "sourceId": "T18-HANDS-ON-ANATOMY-2024",
      "subjectId": "HA-M-000004",
      "field": "origin",
      "locator": "Chapter 7 > Tibialis Posterior > Origin(s)",
      "accessedOn": "2026-09-27",
      "accessMethod": "publisher_full_text",
      "textAccess": "full_text_opened",
      "accessOutcome": "opened",
      "note": "Opened the named source page and inspected the field for 후경골근."
    },
    {
      "id": "A-SP-HA-M-000004-origin",
      "sourceId": "T18-STATPEARLS-FOOT-MUSCLES-2025",
      "subjectId": "HA-M-000004",
      "field": "origin",
      "locator": "Table 1, Tibialis posterior row, Origin column",
      "accessedOn": "2026-09-27",
      "accessMethod": "repository_full_text",
      "textAccess": "full_text_opened",
      "accessOutcome": "opened",
      "note": "Opened the named source page and inspected the field for 후경골근."
    },
    {
      "id": "A-HOA-HA-M-000004-insertion",
      "sourceId": "T18-HANDS-ON-ANATOMY-2024",
      "subjectId": "HA-M-000004",
      "field": "insertion",
      "locator": "Chapter 7 > Tibialis Posterior > Insertion(s)",
      "accessedOn": "2026-09-27",
      "accessMethod": "publisher_full_text",
      "textAccess": "full_text_opened",
      "accessOutcome": "opened",
      "note": "Opened the named source page and inspected the field for 후경골근."
    },
    {
      "id": "A-SP-HA-M-000004-insertion",
      "sourceId": "T18-STATPEARLS-FOOT-MUSCLES-2025",
      "subjectId": "HA-M-000004",
      "field": "insertion",
      "locator": "Table 1, Tibialis posterior row, Insertion column",
      "accessedOn": "2026-09-27",